{
  "artifacts": [
    {
      "media_type": "text/csv",
      "name": "hpx.profile-layers",
      "optional": false,
      "path": "profile_results.csv",
      "producer": "hpx",
      "role": "core",
      "sha256": "6909cab0ef987c5eff18136db87c96922a1ad9c49548e52246dcd285c854e9b4",
      "size_bytes": 1179
    },
    {
      "media_type": "application/json",
      "name": "hpx.summary",
      "optional": false,
      "path": "summary.json",
      "producer": "hpx",
      "role": "core",
      "schema": "hpx.run-summary",
      "schema_version": 5,
      "sha256": "33fc47786005d4e3758bd26f2d8c8dd8e8ce17f89da9bf2d3df620ecef80943b",
      "size_bytes": 21407
    },
    {
      "media_type": "application/json",
      "name": "hpx.run-metadata",
      "optional": false,
      "path": "run_metadata.json",
      "producer": "hpx",
      "role": "core",
      "schema": "hpx.run-metadata",
      "schema_version": 1,
      "sha256": "36a4e7213d29a98255b15b2a8294c55609e1b4a72088ac36c8648a9a9622a975",
      "size_bytes": 43897
    },
    {
      "media_type": "application/yaml",
      "name": "hpx.nsx-lock",
      "optional": false,
      "path": "nsx.lock",
      "producer": "neuralspotx",
      "role": "core",
      "sha256": "d5ffa9807dcda6a66fa2f9e256869a0f989e5c5555540aec4dc26c0000d8c31f",
      "size_bytes": 5733
    }
  ],
  "bundle_type": "profile",
  "comparability": {
    "architecture_flags": null,
    "arena_location": null,
    "board": "apollo510_evb",
    "compiler_version": "clang version 22.1.0",
    "cpu_clock": "lp",
    "engine": "helia-rt",
    "engine_version": "1.20.0",
    "hpx_version": "0.1.6",
    "link_family": "gnu",
    "model_sha256": "935c513a5f4dbfe6458c16b0a791e916f5e89d6c9b02ffbefce49c06fbbdf038",
    "run_metadata_schema_version": 1,
    "run_summary_schema_version": 5,
    "soc": "apollo510",
    "system_clock_hz": 96000000,
    "toolchain": "atfe",
    "transport": "rtt",
    "weights_location": null
  },
  "extensions": {},
  "hpx_version": "0.1.6",
  "issues": [],
  "provenance": {
    "build_images": [
      {
        "architecture_flags": {},
        "binary_name": "hpx_profiler",
        "role": "profile",
        "sha256": "b0b4d771c6f9d62478e4ee1ccd3c27883b232123e44382a1935ec6e17592e4a2",
        "size_bytes": 3175684,
        "target_name": "hpx_profiler",
        "translation_units": 0
      }
    ],
    "compatibility": {
      "baseline": {
        "baseline_id": "hpx-neuralspotx-0.8.1-2026-09",
        "engines": {
          "executorch": {
            "ref": "5514ac1ea8439b3fe615d180bf68c75a9dabb48e",
            "version": "0.1.0"
          },
          "helia-aot": {
            "max_version_exclusive": "0.21.0",
            "min_version": "0.20.0"
          },
          "helia-rt": {
            "ref": "edb3a25fc96c8e9b634dabdb9cd31cb22aa43440",
            "version": "1.20.0"
          },
          "tflm": {
            "governed_by_modules": true
          }
        },
        "modules": {
          "arm-cmsis-nn": {
            "project": "arm-cmsis-nn",
            "ref": "6d21a6f821fb72541173a6c4d05d83329fa74f7c"
          },
          "nsx-ambiq-bsp": {
            "project": "nsx-ambiq-sdk",
            "ref": "a9f4ec25a162f6f3700623feb691423bb5a51132"
          },
          "nsx-cmsis-nn": {
            "project": "ns-cmsis-nn",
            "ref": "aaeb145a67c3decd9869f96474e36e7dbdc2030c"
          },
          "nsx-executorch": {
            "project": "nsx-executorch",
            "ref": "5514ac1ea8439b3fe615d180bf68c75a9dabb48e"
          },
          "nsx-helia-rt": {
            "project": "helia-rt",
            "ref": "edb3a25fc96c8e9b634dabdb9cd31cb22aa43440"
          },
          "nsx-pmu-armv8m": {
            "project": "nsx-pmu-armv8m",
            "ref": "5725c065a0c3603132f1064ee2684d1fa8587c88"
          },
          "nsx-sensors": {
            "project": "nsx-sensors",
            "ref": "c219a2bc98c62f96819fae20ab6c8911fcea3e25"
          },
          "nsx-tflite-micro": {
            "project": "nsx-tflite-micro",
            "ref": "7afcf2b4170e039caf4c49f91e2c45d5869be333"
          }
        },
        "neuralspotx": {
          "package": "neuralspotx",
          "sha256": "7aac6f1b2e89ebf41dfe087c7588e0db11d65e8a11cac2cda03f6d7c510a9094",
          "version": "0.8.1"
        },
        "projects": {
          "arm-cmsis-nn": {
            "ref": "6d21a6f821fb72541173a6c4d05d83329fa74f7c",
            "url": "https://github.com/AmbiqAI/arm-cmsis-nn.git"
          },
          "helia-rt": {
            "ref": "edb3a25fc96c8e9b634dabdb9cd31cb22aa43440",
            "url": "https://github.com/AmbiqAI/helia-rt.git"
          },
          "neuralspotx": {
            "ref": "2dbe12a2799fd8c3df85f1a103b0adca340c901f",
            "url": "https://github.com/AmbiqAI/neuralspotx.git"
          },
          "ns-cmsis-nn": {
            "ref": "aaeb145a67c3decd9869f96474e36e7dbdc2030c",
            "url": "https://github.com/AmbiqAI/ns-cmsis-nn.git"
          },
          "nsx-ambiq-sdk": {
            "ref": "a9f4ec25a162f6f3700623feb691423bb5a51132",
            "url": "https://github.com/AmbiqAI/nsx-ambiq-sdk.git"
          },
          "nsx-executorch": {
            "ref": "5514ac1ea8439b3fe615d180bf68c75a9dabb48e",
            "url": "https://github.com/AmbiqAI/nsx-executorch.git"
          },
          "nsx-pmu-armv8m": {
            "ref": "5725c065a0c3603132f1064ee2684d1fa8587c88",
            "url": "https://github.com/AmbiqAI/nsx-pmu-armv8m.git"
          },
          "nsx-sensors": {
            "ref": "c219a2bc98c62f96819fae20ab6c8911fcea3e25",
            "url": "https://github.com/AmbiqAI/nsx-sensors.git"
          },
          "nsx-tflite-micro": {
            "ref": "7afcf2b4170e039caf4c49f91e2c45d5869be333",
            "url": "https://github.com/AmbiqAI/nsx-tflite-micro.git"
          }
        },
        "schema": "hpx.compatibility-baseline",
        "schema_version": 1
      },
      "baseline_fingerprint": "ec2f81db229825ea772a2594e50decd55acb7ff84fbe6536bc4af44c8107068b",
      "engine_overrides": [],
      "module_overrides": [],
      "qualification": "qualified"
    },
    "config_sha256": "82635f05ea7562fdf724a4280b47724201ce09424ad40816a2cccceebcf50fa4",
    "dependencies": {
      "lock": {
        "frozen_sync": true,
        "manifest_hash": {
          "algorithm": "sha256",
          "value": "d20bd08cd83a0b95f875feeeecef037373969bce647fca165d0dab639d6c151b"
        },
        "mode": "reused",
        "offline": false,
        "schema_version": 4,
        "sha256": {
          "algorithm": "sha256",
          "value": "d5ffa9807dcda6a66fa2f9e256869a0f989e5c5555540aec4dc26c0000d8c31f"
        },
        "update_requested": false
      },
      "modules": [
        {
          "content_hash": {
            "algorithm": "sha256",
            "value": "4ca0d4e197abbb9a0165baebb6b7832d24b6fd23f1a47e424e9f5a01fbd459c6"
          },
          "kind": "git",
          "name": "nsx-ambiq-bsp",
          "peeled_commit": "a9f4ec25a162f6f3700623feb691423bb5a51132",
          "project": "nsx-ambiq-sdk",
          "requested_ref": "a9f4ec25a162f6f3700623feb691423bb5a51132",
          "requested_tag": null,
          "url": "https://github.com/AmbiqAI/nsx-ambiq-sdk.git",
          "vendored_at": "modules/nsx-ambiq-sdk"
        },
        {
          "content_hash": {
            "algorithm": "sha256",
            "value": "4ca0d4e197abbb9a0165baebb6b7832d24b6fd23f1a47e424e9f5a01fbd459c6"
          },
          "kind": "git",
          "name": "nsx-ambiq-hal",
          "peeled_commit": "a9f4ec25a162f6f3700623feb691423bb5a51132",
          "project": "nsx-ambiq-sdk",
          "requested_ref": "a9f4ec25a162f6f3700623feb691423bb5a51132",
          "requested_tag": null,
          "url": "https://github.com/AmbiqAI/nsx-ambiq-sdk.git",
          "vendored_at": "modules/nsx-ambiq-sdk"
        },
        {
          "content_hash": {
            "algorithm": "sha256",
            "value": "4ca0d4e197abbb9a0165baebb6b7832d24b6fd23f1a47e424e9f5a01fbd459c6"
          },
          "kind": "git",
          "name": "nsx-ambiqsuite",
          "peeled_commit": "a9f4ec25a162f6f3700623feb691423bb5a51132",
          "project": "nsx-ambiq-sdk",
          "requested_ref": "a9f4ec25a162f6f3700623feb691423bb5a51132",
          "requested_tag": null,
          "url": "https://github.com/AmbiqAI/nsx-ambiq-sdk.git",
          "vendored_at": "modules/nsx-ambiq-sdk"
        },
        {
          "content_hash": {
            "algorithm": "sha256",
            "value": "2ebb8c832db7c052dc4236004f4f4e106e15b4747bfde16fc22474a1cd9b34bb"
          },
          "kind": "packaged",
          "name": "nsx-board-apollo510-evb",
          "peeled_commit": null,
          "project": "neuralspotx",
          "requested_ref": "packaged",
          "requested_tag": null,
          "url": null,
          "vendored_at": "boards/apollo510_evb"
        },
        {
          "content_hash": {
            "algorithm": "sha256",
            "value": "4ca0d4e197abbb9a0165baebb6b7832d24b6fd23f1a47e424e9f5a01fbd459c6"
          },
          "kind": "git",
          "name": "nsx-cmsis-core",
          "peeled_commit": "a9f4ec25a162f6f3700623feb691423bb5a51132",
          "project": "nsx-ambiq-sdk",
          "requested_ref": "a9f4ec25a162f6f3700623feb691423bb5a51132",
          "requested_tag": null,
          "url": "https://github.com/AmbiqAI/nsx-ambiq-sdk.git",
          "vendored_at": "modules/nsx-ambiq-sdk"
        },
        {
          "content_hash": {
            "algorithm": "sha256",
            "value": "a02935baf255b4bd2c03cab27a58f289155d0972103413f274e23c687261ac10"
          },
          "kind": "git",
          "name": "nsx-cmsis-nn",
          "peeled_commit": "aaeb145a67c3decd9869f96474e36e7dbdc2030c",
          "project": "ns-cmsis-nn",
          "requested_ref": "aaeb145a67c3decd9869f96474e36e7dbdc2030c",
          "requested_tag": null,